date,time,headline,datetime
2023-10-01,09:30AM,Top NASDAQ ETFs for Q4 2023,2023-10-01 09:30:00
2023-10-01,12:00AM,AP Top Financial News at 7:44 a.m. EDT,2023-10-01 00:00:00
2023-10-01,12:00AM,AP Top Extended Financial Headlines at 7:44 a.m. EDT,2023-10-01 00:00:00
2023-09-30,10:39PM,Meta's AI gambits; Amazon's  antitrust fight with FTC: Weekly tech roundup,2023-09-30 22:39:00
2023-09-30,06:13PM,Top 5 Augmented Reality (AR) Stocks Among Hedge Funds,2023-09-30 18:13:00
2023-09-30,06:03PM,Apple identifies issues causing overheating in the iPhone 15,2023-09-30 18:03:00
2023-09-30,12:01PM,Apple says it will fix software problems blamed for making iPhone 15 models too hot to handle,2023-09-30 12:01:00
2023-09-30,12:00PM,"Is Meta Stock A Buy? Facebook Parent Wows With AI Glasses, Avatars And Chart Pattern",2023-09-30 12:00:00
2023-09-30,10:32AM,15 Best Beginner Stocks To Buy Now,2023-09-30 10:32:00
2023-09-30,08:00AM,Talking Digital Privacy With Cybersecurity Expert and Author Tom Kemp,2023-09-30 08:00:00
2023-09-30,08:00AM,Apple Has an iPhone Problem,2023-09-30 08:00:00
2023-09-30,07:06AM,Can AI Imitate the 50 Greatest Classical Music Composers of All Time?,2023-09-30 07:06:00
2023-09-30,05:50AM,"Every Artificial Intelligence (AI) Stock Warren Buffett Owns, Ranked From Best to Worst",2023-09-30 05:50:00
2023-09-30,12:00AM,AP Top Financial News at 1:51 p.m. EDT,2023-09-30 00:00:00
2023-09-29,02:38PM,Deep Value Stocks ETFs: Top 10 Picks,2023-09-29 14:38:00
2023-09-29,02:15PM,Apple finally solves a very urgent iPhone issue,2023-09-29 14:15:00
2023-09-29,01:33PM,"Microsoft revealed this week that Apple used Bing as a bargaining chip with Google, but it reportedly considered buying it and bringing search in-house",2023-09-29 13:33:00
2023-09-29,01:19PM,12 Best Vanguard ETFs for Portfolio Diversification,2023-09-29 13:19:00
2023-09-29,12:26PM,25 Hottest Selling Products in USA in 2023,2023-09-29 12:26:00
2023-09-29,12:20PM,20 Most Influential Entrepreneurs Today,2023-09-29 12:20:00
2023-09-29,11:45AM,The Dows Biggest 12-Month Winner Isnt What You Might Expect,2023-09-29 11:45:00
2023-09-29,11:13AM,Apple met with Chinese officials to discuss app restrictions: Report,2023-09-29 11:13:00
2023-09-29,09:51AM,Megacap Slump Is Testing Apples Safe-Haven Status,2023-09-29 09:51:00
2023-09-29,07:21AM,Apples Latest China Challenge: A Crackdown That Could Shrink Its App Store,2023-09-29 07:21:00
2023-09-29,07:18AM,5 Things to Know Before Markets Open,2023-09-29 07:18:00
2023-09-29,06:10AM,Better Buy: Amazon vs Apple,2023-09-29 06:10:00
2023-09-29,06:02AM,"1 Green Flag for Apple in 2023, and 1 Red Flag",2023-09-29 06:02:00
2023-09-29,05:55AM,"Apple, China Met to Discuss Beijings Crackdown on Western Apps",2023-09-29 05:55:00
2023-09-29,05:37AM,"UPDATE 1-Apple, China met to discuss Beijing's crackdown on western apps- WSJ",2023-09-29 05:37:00
2023-09-29,05:30AM,Why stocks may just roll into an October correction,2023-09-29 05:30:00
2023-09-29,05:21AM,"These 7 Dividend Stocks Pay $98 Billion Annually, Combined, to Their Shareholders",2023-09-29 05:21:00
2023-09-29,05:10AM,"Apple, China met to discuss Beijing's crackdown on western apps- WSJ",2023-09-29 05:10:00
2023-09-29,05:06AM,83% of Warren Buffett's $347 Billion Portfolio Is Invested in Only 8 Stocks,2023-09-29 05:06:00
2023-09-29,04:21AM,French authorities approve Apple's software update of its iphone 12,2023-09-29 04:21:00
2023-09-29,02:08AM,10 Best India ETFs,2023-09-29 02:08:00
2023-09-28,05:38PM,Microsoft Discussed Selling Bing to Apple as Google Replacement,2023-09-28 17:38:00
2023-09-28,05:28PM,Fitbit Charge 6 brings better heart rate tracking and deeper Google integration,2023-09-28 17:28:00
2023-09-28,05:17PM,"U.S.-China Chip War Over Taiwan Nears Moment Of Truth For S&P 500, Nvidia, Apple And The World",2023-09-28 17:17:00
2023-09-28,04:39PM,Warren Buffett Stocks: What's Inside Berkshire Hathaway's Portfolio?,2023-09-28 16:39:00
2023-09-28,04:12PM,Apple iPhone 15 Pro users reporting overheating issues,2023-09-28 16:12:00
2023-09-28,02:50PM,"New space age titanium iPhone 15s are overheating, customers complain",2023-09-28 14:50:00
2023-09-28,02:28PM,Microsoft Considered Investing Billions in Apple Deal to Compete With Google Search,2023-09-28 14:28:00
2023-09-28,12:40PM,Apple stock: What the charts show about its returns in October,2023-09-28 12:40:00
2023-09-28,12:39PM,Microsoft executive says Google deals kept Bing small,2023-09-28 12:39:00
2023-09-28,12:30PM,The AI rush for the iPhone moment,2023-09-28 12:30:00
2023-09-28,11:24AM,Alphabet (GOOGL) Boosts Chromebook Features With ChromeOS 117,2023-09-28 11:24:00
2023-09-28,11:08AM,iPhone customers claim they have a serious issue with the iPhone 15,2023-09-28 11:08:00
2023-09-28,10:25AM,Thousands of Apple customers complain latest iPhone models are overheating,2023-09-28 10:25:00
2023-09-28,10:17AM,15 Best U.S. Stocks to Buy Now Under $10,2023-09-28 10:17:00
2023-09-28,10:16AM,Block (SQ) Boosts Reach to Canada With Tap to Pay on Android,2023-09-28 10:16:00
2023-09-28,10:08AM,Apple Stock Is Set for the Worst Month of the Year. This iPhone Problem Isnt Helping.,2023-09-28 10:08:00
2023-09-28,09:56AM,40 Best Selling Items on eBay in 2023,2023-09-28 09:56:00
2023-09-28,09:19AM,Apple asks US Supreme Court to strike down Epic Games order,2023-09-28 09:19:00
2023-09-28,08:45AM,3 Dividend Stocks to Buy and Hold Until Retirement,2023-09-28 08:45:00
2023-09-28,08:44AM,Apples Set for the Worst Month of the Year. This iPhone Problem Isnt Helping.,2023-09-28 08:44:00
2023-09-28,08:00AM,"Got $1,000? 5 Buffett Stocks to Buy and Hold Forever",2023-09-28 08:00:00
2023-09-28,06:10AM,Is Apple Stock a Buy Now?,2023-09-28 06:10:00
2023-09-28,06:00AM,"Column: The FTC is right about Amazon's monopolistic practices, but struggles with what to do about them",2023-09-28 06:00:00
2023-09-28,06:00AM,Microsoft exec remains tight-lipped about making in-house AI chips,2023-09-28 06:00:00
2023-09-28,05:30AM,How Apple could be affected by Amazon's antitrust ruling,2023-09-28 05:30:00
2023-09-28,05:30AM,Secrecy of Google Antitrust Trial Leads to Blame Game,2023-09-28 05:30:00
2023-09-28,05:30AM,Apple missing from China's list of 26 registered app stores after requirement to submit information to government,2023-09-28 05:30:00
2023-09-28,05:21AM,"Wall Street's ""Magnificent Seven"" May Be a Mammoth Liability for the Stock Market",2023-09-28 05:21:00
2023-09-28,04:09AM,British iPhone designer Sir Jony Ive explores plan for AI gadget,2023-09-28 04:09:00
2023-09-28,03:22AM,"OpenAI, Jony Ive in talks to raise $1 bln from SoftBank for AI device venture - FT",2023-09-28 03:22:00
2023-09-28,02:16AM,OpenAI and Jony Ive in talks to raise $1bn from SoftBank for AI device venture,2023-09-28 02:16:00
2023-09-28,12:41AM,Apples iPhone Cedes Ground to Googles Pixel in Japan,2023-09-28 00:41:00
2023-09-27,08:56PM,Epic asks the Supreme Court to weigh in on its beef with Apple,2023-09-27 20:56:00
2023-09-27,08:41PM,iPhone 15 Pro Owners Complain About Overheating Problems,2023-09-27 20:41:00
2023-09-27,07:24PM,Apple iPhone 15 Pro Users Complain That Device Can Get Too Hot,2023-09-27 19:24:00
2023-09-27,05:45PM,Apple (AAPL) Stock Sinks As Market Gains: What You Should Know,2023-09-27 17:45:00
2023-09-27,04:35PM,"Meta unveils new AR/VR headseat, smart glasses",2023-09-27 16:35:00
2023-09-27,04:29PM,Facebook Needs to Continue Covering Metas Expensive Quest,2023-09-27 16:29:00
2023-09-27,04:25PM,Apple is ordered to face Apple Pay antitrust lawsuit,2023-09-27 16:25:00
2023-09-27,04:21PM,Meta Goes Head-to-Head with Apple with its New Quest 3 Headset,2023-09-27 16:21:00
2023-09-27,03:50PM,Tim Cook's net worth: How much the Apple CEO's stock is worth,2023-09-27 15:50:00
2023-09-27,03:33PM,"Apple leverages idea of switching to Bing to pry more money out of Google, Microsoft exec says",2023-09-27 15:33:00
2023-09-27,03:17PM,Epic Games asks US Supreme Court to review Apple antitrust case,2023-09-27 15:17:00
2023-09-27,02:09PM,"Meta unveils Meta Quest 3 headset, Ray-Ban Meta smart glasses",2023-09-27 14:09:00
2023-09-27,02:08PM,"Meta Rolls Out Higher-Priced Quest 3 Headset, Just Ahead of Apples Vision Pro",2023-09-27 14:08:00
2023-09-27,02:06PM,Microsoft Says Apple Used Bing as Google Bargaining Chip,2023-09-27 14:06:00
2023-09-27,01:36PM,Best Dow Jones Stocks To Buy And Watch In September 2023: Apple Hits Recent Low,2023-09-27 13:36:00
2023-09-27,01:02PM,British designer of the iPhone explores plan for AI gadget,2023-09-27 13:02:00
2023-09-27,11:47AM,"Apple Defends Its $19B Google Search Deal, Hollywood's Writers Secure Credit For AI Training, China's Ambitious Chip Fund Faces Headwinds: Today's Top Stories",2023-09-27 11:47:00
2023-09-27,11:36AM,There's only one smartphone brand selling more devices in Q2 and it isn't who you might think,2023-09-27 11:36:00
2023-09-27,11:25AM,"Blockbuster report of OpenAIs talks with iPhone designer Jony Ive about an AI hardware device suggests he wants a front-row seat for the AI revolution, top analyst says",2023-09-27 11:25:00
2023-09-27,11:20AM,Amazon and These 2 Other Tech Giants Need to Start Paying Dividends,2023-09-27 11:20:00
2023-09-27,11:18AM,Tech sector could be nearing a correction,2023-09-27 11:18:00
2023-09-27,10:09AM,Apple exec Eddy Cue on Google search: 'There wasn't a valid alternative',2023-09-27 10:09:00
2023-09-27,10:07AM,Can the iPhone 15 Help Reverse Apple's Sales Decline?,2023-09-27 10:07:00
2023-09-27,10:00AM,Apple Delays Newest Processor Rollout -- Is Taiwan Semi Manufacturing in Deep Trouble?,2023-09-27 10:00:00
2023-09-27,09:19AM,Apple Remains Silent On Strategy As China's Cyberspace Watchdog Tightens Reins On App Stores,2023-09-27 09:19:00
2023-09-27,05:15AM,"2 Remarkable Artificial Intelligence (AI) Growth Stocks With More Upside Than Apple and Microsoft to Buy Now, According to Wall Street",2023-09-27 05:15:00
2023-09-27,05:06AM,"Warren Buffett Is Selling Shares of This High-Yield Dividend Stock and, Likely, Buying Shares of His Favorite Stock (No, Not Apple!)",2023-09-27 05:06:00
2023-09-27,01:08AM,"UPDATE 1-China lists mobile app stores that comply with new rule, but Apple missing",2023-09-27 01:08:00
2023-09-26,11:28PM,"Ex-Apple designer Ive, OpenAI's Altman discuss AI hardware -The Information",2023-09-26 23:28:00
2023-09-26,11:22PM,"REFILE-Ex-Apple designer Ive, OpenAI's Altman discuss AI hardware -The Information",2023-09-26 23:22:00
2023-09-26,04:08PM,"Apple, Google Agreed to Defend Search Deal From Regulators",2023-09-26 16:08:00
2023-09-26,04:00PM,Apple reveals groundbreaking new changes to AirPods Pro,2023-09-26 16:00:00
2023-09-26,02:45PM,Why Would You Want to Own an Apple That's Going Bad?,2023-09-26 14:45:00
